article_id,pmid,title,abstract,authors,journal,pub_year,language,source_file
PMID40782764,40782764,Unlocking the gut-lung axis: Feixin decoction as a novel modulator in hypoxic pulmonary hypertension.,"[BACKGROUND] Feixin decoction (FXD) is an effective traditional Chinese medicine prescription for treating chronic pulmonary heart disease and hypoxic pulmonary hypertension (HPH), However, the pharmacological mechanism of FXD in preventing HPH remains unclear. [PURPOSE] This study aimed to evaluate the preventive and therapeutic effect of FXD on HPH and confirm the association between HPH, gut microbiota, and FXD. [METHODS] Multiple in vivo animal models were used, including HPH rat models, microbiota depletion models, and fecal microbiota transplantation (FMT) models. The HPH phenotype was evaluated through: right heart catheterization for hemodynamic parameters, doppler echocardiography for cardiac function assessment, hematoxylin-eosin staining for histopathological examination, and immunofluorescence labeling for specific protein expression analysis. Concurrently, transmission electron microscopy was utilized to observe the ultrastructure of the intestinal barrier, combined with immunofluorescence to examine the distribution characteristics of tight junction proteins. To elucidate the mechanism by which HPH ameliorates gut microbiota dysbiosis and associated metabolites, the study integrated 16S rRNA sequencing for microbiota composition analysis, dual-platform untargeted metabolomics for differential metabolite screening, and targeted metabolomics for quantitative validation. [RESULTS] FXD exhibited significant therapeutic effects in HPH rats, ameliorating pulmonary vascular remodeling, attenuating right ventricular hypertrophy, reducing systemic inflammation, and restoring intestinal barrier function. Additionally, FXD partially restored intestinal ecological balance by enriching beneficial species (Lactobacillus and Lactobacillus johnsonii) while reducing pathogenic genera (Escherichia-Shigella and Helicobacter rodentium). Concurrently, FXD treatment induced favorable metabolic alterations, characterized by elevated levels of beneficial metabolites including eicosapentaenoic acid (EPA) and docosahexaenoic acid (DHA), along with reduced concentrations of pro-inflammatory 5-hydroxytryptamine (5-HT). Gut microbiota depletion and fecal microbiota transplantation (FMT) studies established that FXD's therapeutic effects on HPH are mediated through gut microbiota modulation. Mechanistic investigations revealed that this protection likely involves inhibition of the TLR4/MyD88/NF-κB signaling pathway. In vitro studies further corroborated these findings, showing that FXD-enriched metabolites potently suppressed abnormal proliferation, migration and apoptosis in human pulmonary arterial smooth muscle cells (HPASMCs). Notably, EPA, the most significantly increased metabolite, specifically attenuates hypoxia-induced HPASMCs proliferation by interfering with the TLR4/MyD88/NF-κB signaling axis. [CONCLUSIONS] Our study confirms that FXD alleviates HPH by regulating gut microbiota and its associated metabolites and validates the potential of FXD as a gut microbiota modulator and an HPH treatment, thereby providing a new therapeutic strategy to improve treatment efficacy.",Wang Fei-Ying; Yi Jian; Zhou Ling-Ling; Tan Jun-Lan; Cao Xian-Ya; Zhang Chao; Wan Jia-Jing; Song Lan; Dai Ai-Guo,Phytomedicine,2025,en,hypertension_tcm.csv
PMID26699542,26699542,Chinese Herbal Medicine Treatment Improves the Overall Survival Rate of Individuals with Hypertension among Type 2 Diabetes Patients and Modulates In Vitro Smooth Muscle Cell Contractility.,"Type 2 diabetes (T2D) is a chronic, multifactorial, and metabolic disorder accounting for 90% diabetes cases worldwide. Among them, almost half of T2D have hypertension, which is responsible for cardiovascular disease, morbidity, and mortality in these patients. The Chinese herbal medicine (CHM) prescription patterns of hypertension individuals among T2D patients have yet to be characterized. This study, therefore, aimed to determine their prescription patterns and evaluate the CHM effect. A cohort of one million randomly sampled cases from the National Health Insurance Research Database (NHIRD) was used to investigate the overall survival rate of CHM users, and prescription patterns. After matching CHM and non-CHM users for age, gender and date of diagnosis of hypertension, 980 subjects for each group were selected. The CHM users were characterized with slightly longer duration time from diabetes to hypertension, and more cases for hyperlipidaemia. The cumulative survival probabilities were higher in CHM users than in non-CHM users. Among these top 12 herbs, Liu-Wei-Di-Huang-Wan, Jia-Wei-Xiao-Yao-San, Dan-Shen, and Ge-Gen were the most common herbs and inhibited in vitro smooth muscle cell contractility. Our study also provides a CHM comprehensive list that may be useful in future investigation of the safety and efficacy for individuals with hypertension among type 2 diabetes patients.",Lin Ying-Ju; Ho Tsung-Jung; Yeh Yi-Chun; Cheng Chi-Fung; Shiao Yi-Tzone; Wang Chang-Bi; Chien Wen-Kuei; Chen Jin-Hua; Liu Xiang; Tsang Hsinyi; Lin Ting-Hsu; Liao Chiu-Chu; Huang Shao-Mei; Li Ju-Pi; Lin Cheng-Wen; Pang Hao-Yu; Lin Jaung-Geng; Lan Yu-Ching; Liu Yu-Huei; Chen Shih-Yin; Tsai Fuu-Jen; Liang Wen-Miin,PLoS One,2015,en,hypertension_tcm.csv
PMID12466048,12466048,Pharmacological actions of tetrandrine in inflammatory pulmonary diseases.,"Tetrandrine is a principle from a traditional Chinese medicine of the root of Stephania tetrandra S Moore approved by State Drugs Administration of China as a new drug for the treatment of silicosis. Except for its antiinflammatory, antifibrogenetic, immunomodulating effects and antioxidant effects, tetrandrine presents antiallergic effects, inhibitory effects on pulmonary vessels and airway smooth muscle contraction, and platelet aggregation via its nonspecific calcium channel antagonism that suggested its potential in the treatment of asthma, pulmonary hypertension and chronic obstructive pulmonary disease (COPD). In general, the clinical results to date with tetrandrine in asthma and pulmonary hypertension have been exciting. The last 10 years have witnessed great leaps forward in our understanding of the molecular biology and biochemistry of chronic inflammatory diseases as well as the treatment drugs, which may create opportunities for future therapeutic innovation, development of tetrandrine derivatives or new extracts from other Chinese medicine. The current article briefly reviews the basic and clinical pharmacology of tetrandrine as well as the in vitro and in vivo data supporting the view that tetrandrine is as a novel drug for the treatment of silicosis, asthma and pulmonary hypertension.",Xie Qiang-Min; Tang Hui-Fang; Chen Ji-Qiang; Bian Ru-Lian,Acta Pharmacol Sin,2002,en,hypertension_tcm.csv
PMID28950827,28950827,Beneficial Effects of Corn Silk on Metabolic Syndrome.,"Metabolic syndrome (MS) is a very common medical problem worldwide. It includes obesity, hypertension, hyperglycemia, and abnormal levels of triglycerides and high-density lipoprotein cholesterol. It is closely associated with insulin resistance and may lead to diabetes mellitus, liver diseases, or cardiovascular diseases. Corn silk (CS), a traditional Chinese medicine, has been reported to have multiple beneficial effects, including hypotensive, anti-diabetic, and hypolipidemic properties. This suggests that corn silk could be used to treat or prevent metabolic syndrome. In this review, we will discuss the potential role of corn silk in different components of metabolic syndrome.",Wang Bing; Xiao Tiegang; Ruan Jun; Liu Wensheng,Curr Pharm Des,2017,en,hypertension_tcm.csv
PMID28356117,28356117,Association of traditional Chinese medicine therapy and the risk of dementia in patients with hypertension: a nationwide population-based cohort study.,"[BACKGROUND] Patients with hypertension (HTN) reportedly have a higher risk of developing dementia. However, it remains unclear if use of Traditional Chinese Medicine (TCM), the most common form of complementary and alternative medicine, can help lower the risk of dementia for these patients. So the aim of the study was to investigate the effects of TCM on dementia risk among patients with hypertension. [METHODS] This longitudinal cohort study used the Taiwanese National Health Insurance Research Database (NHIRD) to identify 143,382 newly diagnosed hypertension patients aged 20-90 years who received treatment between 1998 and 2007. Among them, 52,365 (36.52%) had received TCM after the onset of hypertension (TCM users), and the remaining 91,017 patients (63.48%) were designated as a control group (non-TCM users). All enrollees were followed until the end of 2012 to record the incidence of dementia. A Cox proportional hazards regression model was used to compute the hazard ratio (HR) of dementia in patients who received TCM. [RESULTS] During the 15-year follow-up, 3933 TCM users and 10,316 non-TCM users developed dementia, representing an incidence rate of 8.41 and 11.55%, respectively, per 1000 person-years. TCM users had a significantly reduced risk of dementia compared to non-TCM users (adjusted HR = 0.76; 95% confidence interval [CI] = 0.74-0.81). The predominant effect was observed among those treated with TCM longer than 180 days (adjusted HR = 0.65; 95% CI = 0.62-0.69). Among the commonly used TCM products, Tian-Ma-Gou-Teng-Yin, Dan-Shen (Radix Salviae Miltiorrhizae), Chuan-Niu-Xi (Radix Cyathulae), Ge-Gen (Radix Puerariae), Jia-Wei-Xiao-Yao-San, and Jue-Ming-Zi (Semen Cassiae) were significantly associated with a lower risk of dementia. [CONCLUSIONS] Results from this population-based study support the effects of TCM on reducing dementia risk, which may provide a reference for dementia prevention strategies.",Chen Kuen-Hau; Yeh Ming-Hsien; Livneh Hanoch; Chen Bor-Chyuan; Lin I-Hsin; Lu Ming-Chi; Tsai Tzung-Yi; Yeh Chia-Chou,BMC Complement Altern Med,2017,en,hypertension_tcm.csv
PMID23674113,23674113,Chronic intermittent hypoxia and hypertension: a review of systemic inflammation and Chinese medicine.,"Obstructive sleep apnea syndrome (OSAS) and hypertension commonly coexist. Clinical studies indicate that OSAS plays a key role in increasing the risk of prevalent hypertension. Chronic intermittent hypoxia (CIH) is the core pathological mechanism of OSAS, and has a close relationship with systemic inflammation. Growing evidence shows that CIH and hypertension are strongly related, involving markers or pathways indicative of systemic inflammation, such as high-sensitivity C-reactive protein (hs-CRP), interleukin-6, nuclear factor-kappa B, tumor necrosis factor-α, interleukin-8 and p38 mitogen-activated protein kinase (MAPK)-dependent pathways. Oxidative stress also plays an important role in this process, including in the activation of polymorphonuclear neutrophils. However, the pathophysiological and clinical significance of systemic inflammation in CIH and hypertension is not proven. This review article highlights the relationship between CIH and hypertension through systemic inflammation and the current interventions available in Chinese medicine, to offer a background for the future treatment of OSAS-related hypertension with integrative medicine.",Wu Chun-Xiao; Liu Yue; Zhang Jing-Chun,Chin J Integr Med,2013,en,hypertension_tcm.csv
PMID38537442,38537442,Therapeutic potential of natural flavonoids in pulmonary arterial hypertension: A review.,"[BACKGROUND] Pulmonary arterial hypertension (PAH) is a fatal disease caused by pulmonary vascular remodeling, with a high incidence and mortality. At present, many clinical drugs for treating PAH mainly exert effects by relaxing the pulmonary artery, with limited therapeutic effects, so the search for viable therapeutic agents continues uninterrupted. In recent years, natural flavonoids have shown promising potential in the treatment of cardiovascular diseases. It is necessary to comprehensively elucidate the potential of natural flavonoids to combat PAH. [PURPOSE] To evaluate the potential of natural flavonoids to hinder or slow down the occurrence and development of PAH, and to identify promising drug discovery candidates. [METHODS] Literature was collected from PubMed, Science Direct, Web of science, CNKI databases and Google scholar. The search terms used included ""pulmonary arterial hypertension"", ""pulmonary hypertension"", ""natural products"", ""natural flavonoids"", ""traditional chinese medicine"", etc., and several combinations of these keywords. [RESULTS] The resources, structural characteristics, mechanisms, potential and prospect strategies of natural flavonoids for treating PAH were summarized. Natural flavonoids offer different solutions as possible treatments for PAH. These mechanisms may involve various pathways and molecular targets related to the pathogenesis of PAH, such as inflammation, oxidative stress, vascular remodeling, genetic, ion channels, cell proliferation and autophagy. In addition, prospect strategies of natural flavonoids for anti-PAH including structural modification and nanomaterial delivery systems have been explored. This review suggests that the potential of natural flavonoids as alternative therapeutic agents in the prevention and treatment of PAH holds promise for future research and clinical applications. [CONCLUSION] Despite displaying the enormous potential of flavonoids in PAH, some limitations need to be further explored. Firstly, using advanced drug discovery tools, including computer-aided design and high-throughput screening, to further investigate the safety, biological activity, and precise mechanism of action of flavonoids. Secondly, exploring the structural modifications of these compounds is expected to optimize their efficacy. Lastly, it is necessary to conduct well controlled clinical trials and a comprehensive evaluation of potential side effects to determine their effectiveness and safety.",Zhang Jin-Jing; Mao-Mao; Shao Min-Min; Wang Meng-Chuan,Phytomedicine,2024,en,hypertension_tcm.csv
PMID31749425,31749425,"Cardiovascular Modulating Effects of Magnolol and Honokiol, Two Polyphenolic Compounds from Traditional Chinese Medicine-Magnolia Officinalis.","Honokiol and its isomer magnolol are poly-phenolic compounds isolated from the Magnolia officinalis that exert cardiovascular modulating effects via a variety of mechanisms. They are used as blood-quickening and stasis-dispelling agents in Traditional Chinese Medicine and confirmed to have therapeutic potential in atherosclerosis, thrombosis, hypertension, and cardiac hypertrophy. This comprehensive review summarizes the current data regarding the cardioprotective mechanisms of those compounds and identifies areas for further research.",Yuan Yuan; Zhou Xiaocui; Wang Yuanyuan; Wang Yan; Teng Xiangyan; Wang Shuaiyu,Curr Drug Targets,2020,en,hypertension_tcm.csv
PMID32702868,32702868,Efficacy and safety of the traditional Chinese medicine tonifying kidney (bu shen) therapy in patients with hypertension: A protocol for systematic review and meta-analysis.,"[BACKGROUND] Hypertension becomes increasingly an alarming global health concern. There is a growing interest in treatment of traditional Chinese medicine (TCM), and tonifying kidney therapy (bushen, TKT) has been extensively used in the treatment of hypertension according to TCM theory. In this article, we outline the protocol of research projects and methods to examine comprehensively the effectiveness and safety of TKT in treating hypertensive patients. [METHODS] We will collect randomized controlled trails (RCTs) that report the application of TKT for patients with hypertension from electronic databases including PubMed, EMBASE, CENTRAL, CNKI, VIP, CBM, and Wanfang database. Time of literature retrieval is set from the beginning of database construction to the end of June, 2020. Two reviewers will independently perform literature screening, data extraction, and quality assessment of included literature, and any divergences will be worked out via discussion. The primary outcomes include total efficacy rate, systolic and diastolic blood pressure change will be assessed. The secondary outcomes include clinical symptoms and adverse events will also be assessed. RevMan5.3 software will be applied to analyzing data included studies. [RESULTS] This study will synthesize and analyze all collated data in order to evaluate TKT for the treatment of hypertension involves different aspects in total efficacy rate, systolic and diastolic blood pressure change, clinical symptoms, and adverse events. [CONCLUSION] This study will determine the efficacy of TKT in the treatment of hypertension and recommend its clinical value based on the evaluated the effectiveness and security results. [REGISTRATION NUMBER] INPLASY202050044.",Tang Zhuoran; Sun Yize; Wang Chao; Liu Xiang; Qi Xin; Ma Di; Zhao Haibin,Medicine (Baltimore),2020,en,hypertension_tcm.csv
PMID40510465,40510465,Association between the ratio of triglycerides to high-density lipoprotein cholesterol and nocturnal hypertension: a cross-sectional study in a Chinese population.,"[BACKGROUND AND OBJECTIVE] The ratio of triglycerides to high-density lipoprotein cholesterol (TG/HDL-C) serves as a predictive indicator for metabolic syndrome and cardiovascular diseases. Simultaneously, nocturnal hypertension significantly increases the risk of target organ damage and cardiovascular events. However, the relationship between the TG/HDL-C ratio and nocturnal hypertension remains unclear. Therefore, the present study aimed to determine the efficacy of the TG/HDL-C ratio in predicting the occurrence of nocturnal hypertension and reducing related adverse events. [METHOD] Our rigorous cross-sectional study, which included 749 participants who underwent 24-hour ambulatory blood pressure monitoring at the Cardiology Center of Changchun University of Chinese Medicine Affiliated Hospital, allowed us to determine the association between the TG/HDL-C ratio and nocturnal hypertension. We employed both univariate and multivariate logistic regression analyses to ensure the robustness of our findings. Logistic regression modeling was used to assess the independent predictive ability of TG/HDL-C for nocturnal hypertension while adjusting for confounders such as sex, age, BMI, and smoking status. Model performance was assessed by subject work characteristics (ROC) curves and area under the curve (AUC). [RESULTS] Among the 749 participants included in this study, 566 were identified with nocturnal hypertension. Univariate logistic regression analysis demonstrated that the TG/HDL-C ratio was positively correlated with the occurrence of nocturnal hypertension, with the risk of nocturnal hypertension increasing by 24% (OR 1.24(1.06-1.45), P=0.006) for every 1-unit increase in the TG/HDL-C ratio. After adjusting for past medical history, medication, and other relevant examinations, a multivariate analysis revealed a significant correlation between the TG/HDL-C ratio and nocturnal hypertension. Logistic regression analysis demonstrated that TG/HDL-C was positively associated with nocturnal hypertension (regression coefficient = 0.115, P < 0.05). After adjusting for sex, age, BMI, and smoking status, TG/HDL-C remained a predictor of nocturnal hypertension. [CONCLUSION] Our study underscores the significant association between an elevated TG/HDL-C ratio and the occurrence of nocturnal hypertension. This finding has the potential to draw the attention of patients and physicians to lipid levels, particularly among males, individuals over 45 years old, those with a BMI greater than 24, smokers, and those with a history of hypertension. An independent positive association between TG/HDL-C and nocturnal hypertension was also determined using logistic regression modeling. The findings suggests that it may have potential application in the early screening of nocturnal hypertension. However, the predictive ability is limited, and further studies are necessary to incorporate larger sample sizes and longitudinal designs. These additional studies would validate the predictive role of TG/HDL-C and explore its biological mechanisms.",Dong Hezeng; Liu Zhaozheng; Zhang Jinling; Han Ye; Zhang Jing; Xi Yazhi; Chang Liping; Deng Yue,Front Endocrinol (Lausanne),2025,en,hypertension_tcm.csv
PMID40836392,40836392,Antihypertensive therapy for pregnancy hypertension and implications for fetal and neonatal heart rate monitoring: A systematic review of randomized trials and observational studies.,"[INTRODUCTION] Our objective was to evaluate whether antihypertensives affect fetal (FHR) or neonatal (neoHR) heart rate. [MATERIAL AND METHODS] Electronic databases and clinical trial registers were searched to August 31, 2024. Eligibility included randomized (RCTs) or observational studies evaluating antihypertensives for pregnancy hypertension. Two reviewers independently assessed studies for inclusion and extracted data. Random effects meta-analysis was used to determine risk ratios (RRs) and 95% confidence intervals (CIs). Network meta-analysis was undertaken in a sensitivity analysis. [RESULTS] Fifty-four RCTs (n = 5736 pregnancies) and 28 observational studies (n = 2 283 855) reported FHR (usually visually-interpreted) or neoHR (usually clinically-assessed). FHR: NON-SEVERE HYPERTENSION: Antihypertensives did not increase adverse FHR effects in RCTs of antihypertensives versus placebo/no therapy (RR = 1.08, 95% CI [0.62-1.89]; I= 43%; N = 10, n = 1567 pregnancies), antihypertensives versus methyldopa (RR = 1.40 [0.97-2.04]; I= 0%; N = 6, n = 515), or labetalol or pure beta-blockers versus other antihypertensives (RR = 1.70 [0.96-2.99]; I= 30%; N = 5, n = 501). In observational studies, adverse FHR effects were more common with: labetalol versus methyldopa, nifedipine or Chinese herbal medication (RR = 2.17 [1.15-4.08]; I= 47%; N = 4, n = 664), and bendroflumethiazide versus metoprolol (but not hydralazine), but 95% CIs were wide. FHR: SEVERE HYPERTENSION: Antihypertensives had no FHR effects in RCTs of antihypertensives versus either: placebo/no therapy (RR = 0.43 [0.16-1.20]; I= 0%; N = 3, n = 242), hydralazine (RR = 0.71 [0.29-1.72]; I= 13%; N = 11, n = 727), or CCBs (RR = 0.52 [0.12-2.16]; I= 0%, N = 9, n = 1675). In observational studies, there was no difference for labetalol versus other antihypertensives (RR = 0.34 [0.10-1.14], I= 87%; N = 4, n = 590), with heterogeneity due to a lower-quality labetalol versus hydralazine study. There were fewer adverse FHR effects for nifedipine versus hydralazine study (RR = 0.09 [0.01-0.68]; n = 49). [NEOHR] SEVERE HYPERTENSION: RCTs of antihypertensives versus placebo/no therapy were not associated with adverse neoHR effects (RR = 1.26 [0.31-5.19]; I= 66%; N = 4, n = 406), with heterogeneity attributed to more neoHR effects with continuously monitored neoHR. Observational studies revealed no effect on neoHR of antihypertensives versus no therapy (RR = 1.06 [0.67-1.67]; I= 54%; N = 4, n = 37 359), but labetalol was associated with more adverse effects and metoprolol with fewer. In RCTs of antihypertensives versus other antihypertensives, there was no difference in adverse neoHR (RR = 3.0 [0.13-71.74]; N = 3, n = 162). Observational studies showed adverse neoHR effects in labetalol versus pure beta-blockers (RR = 1.99 [1.36-2.91]; I= 0%; N = 3, n = 16 204). No severe hypertension RCTs reported neoHR. Observational studies were limited. Network meta-analysis showed no significant relationships between antihypertensives and FHR or neoHR; 95% CIs were very wide. [CONCLUSIONS] Evidence is inadequate to draw reliable conclusions about the impact of antihypertensives on FHR or neoHR. At present, adverse FHR or neoHR effects should be attributed to evolving placental dysfunction.",Ganeshamoorthy Akalya; Duke Omiete Fubara; Mistry Hiten D; Bone Jeffrey N; Vidler Marianne; Abalos Edgardo; Badawy Katie; Khalil Asma; von Dadelszen Peter; Magee Laura A,Acta Obstet Gynecol Scand,2025,en,hypertension_tcm.csv
PMID37927599,37927599,"Chemical composition, biological activities, and quality standards of hawthorn leaves used in traditional Chinese medicine: a comprehensive review.","Hawthorn leaves also known as crataegi foilum, are a combination of botanical drugs used commonly in Traditional Chinese Medicine. Hawthorn, the plant from which hawthorn leaves are prepared, is distributed in Northeast China, North China, and other regions in China. Hawthorn leaves are known to activate blood circulation and eliminate stasis, invigorating Qi, eliminating turbidity, and reducing the levels of lipids. So far, over a hundred compounds have been isolated from hawthorn leaves, including flavonoids, terpenoids, lignans, organic acids, and nitrogenous compounds. Hawthorn leaves are used for the treatment of hypertension, protecting against ischemic injury, angina, hyperglycemia, hyperlipidemia, and certain other conditions. Several of the currently available clinical preparations also use hawthorn leaves as raw materials, such as Yixintong capsules, Xinan capsules, etc. The present report systematically reviews the chemical composition, biological activities, and quality standards of hawthorn leaves, to provide a scientific basis and reference for detailed research on hawthorn leaves.",Guo Wenjing; Shao Tingting; Peng Yu; Wang Haitao; Chen Zhe-Sheng; Su Haixiang,Front Pharmacol,2023,en,hypertension_tcm.csv
