article_id,pmid,title,abstract,authors,journal,pub_year,language,source_file
PMID31035044,31035044,Efficacy and safety of Chinese herbal medicine Xiao Yao San in hypertension: A systematic review and meta-analysis.,"[BACKGROUND] Xiao Yao San (XYS) is thought to be beneficial for the treatment of hypertension in China. [PURPOSE] A systematic review and meta-analysis was performed to evaluate the efficacy and safety of XYS in hypertension. [STUDY DESIGN] A comprehensive literature search was conducted in 7 electronic databases for randomized controlled trials from their inception until January 7, 2019. [METHODS] Methodological quality was assessed independently using the Cochrane Handbook for Systematic Reviews of Interventions. [RESULTS] A total of 17 trials including 1460 hypertensive patients met the selection criteria. Pooled analysis favored XYS plus antihypertensive drugs on blood pressure (BP), Hamilton anxiety scale, self-rating anxiety scale, self-rating depression scale, 9-item patient health questionnaire scale, total cholesterol, triglycerides, high-density lipoprotein cholesterol, low-density lipoprotein cholesterol, homocysteine, and C-reactive protein. No significant difference between XYS plus antihypertensive drugs and antihypertensive drugs on major cardiovascular and cerebrovascular events was identified. XYS was well tolerated in the treatment of hypertension. [CONCLUSION] XYS adjuvant to antihypertensive drugs maybe beneficial for hypertensive patients in lowering BP, improving depression, regulating blood lipids, and inhibiting inflammation. However, the efficacy and safety of XYS are still uncertain due to methodological shortcomings. More long-term, randomized, double-blinded clinical trials are needed in future studies.",Xiong Xingjiang; Wang Pengqian; Duan Lian; Liu Wei; Chu Fuyong; Li Shengjie; Li Xiaoke; Su Kelei; You Hu; Xing Yanwei,Phytomedicine,2019,en,hypertension_tcm.csv
PMID37608811,37608811,The application and mechanism of Chinese medicine in the upstream treatment of atrial fibrillation.,"Upstream treatment of atrial fibrillation (AF, for short) is a new approach to the prevention and treatment of AF with non-antiarrhythmic drugs, which is essentially primary and secondary prevention of AF. The former refers to the prevention of AF by controlling risk factors such as diabetes, hypertension, and heart failure before AF occurs, and the latter mainly refers to targeting ion channels, inflammation, oxidative stress, and other pathways to reduce or reverse atrial electrical and structural remodeling, reduction of AF load, and reduction of the chance of AF occurrence or progression. More and more studies have shown that many traditional Chinese medicines, active ingredients of Chinese medicines, and Chinese herbal formulas have definite effects on the upstream treatment of AF, but their mechanisms of action are different. Therefore, we summarized the relevant literature on the application and mechanisms of Chinese medicine on the upstream treatment of AF in recent years, hoping to be helpful for subsequent studies.",Liu Min; Mao Chenhan; Zhao Fusen; Chen Zhaoyang; Wang Xindong,Front Cardiovasc Med,2023,en,hypertension_tcm.csv
PMID25636788,25636788,Chinese herbal medicine for resistant hypertension: a systematic review.,"[OBJECTIVES] This study aimed to summarise the current evidence from randomised control trials (RCTs) concerning treatment of patients with resistant hypertension with Chinese herbal medicine (CHM). [DESIGN] Seven databases, including the Cochrane Library, PubMed, EMBASE, CNKI, VIP, CBM and Wanfang, were systematically searched from their inception to March 2014 for RCTs investigating treatment of resistant hypertension in which CHM was used either as a monotherapy or in combination with conventional medicine versus placebo, no intervention or conventional medicine. [RESULTS] Five trials containing 446 hypertensive patients were identified. The methodological quality of most trials was evaluated as generally low. All included trials compared CHM plus antihypertensive drugs with antihypertensive drugs alone for resistant hypertension. Formulations of CHM included tablet, decoction and injection. It was found that, compared with antihypertensive drugs alone, CHM (tablet) plus antihypertensive drugs resulted in clinically, but not statistically, significant reductions in systolic blood pressure (SBP; weighted mean difference (WMD)=-10.32 mm Hg; 95% CI -21.10 to 0.46; p=0.06) and diastolic blood pressure (DBP; WMD=-3.30 mm Hg; 95% CI -7.66 to 1.06; p=0.14). CHM (decoction) plus antihypertensive drugs also produced a clinically meaningful, but not statistically significant, reduction in SBP (WMD=-12.56 mm Hg; 95% CI -26.83 to 1.71; p=0.08), and did significantly decrease DBP (WMD=-7.89 mm Hg; 95% CI -11.74 to -4.04; p<0.0001). There were no significant differences in SBP (WMD=-3.50 mm Hg; 95% CI -8.95 to 1.95; p=0.21) and DBP (WMD=1.00 mm Hg; 95% CI -1.39 to 3.39; p=0.41) between CHM (injection) plus the antihypertensive drugs group and antihypertensive drugs alone. The safety of CHM remained uncertain. [CONCLUSIONS] No definite conclusions about the effectiveness and safety of CHM for resistant hypertension could be drawn. More rigorously designed trials are warranted.",Xiong Xingjiang; Li Xiaoke; Zhang Yuqing; Wang Jie,BMJ Open,2015,en,hypertension_tcm.csv
PMID34876914,34876914,"Traditional Chinese Herbal Medicine Plays a Role in the Liver, Kidney, and Intestine to Ameliorate Hyperuricemia according to Experimental Studies.","In the last few decades, hyperuricemia has drawn increasing attention owing to its global prevalence. Observational surveys have manifested that there is a relation between hyperuricemia and increased risks of hypertension, chronic kidney disease, cardiovascular events, metabolic disorders, end stage renal disease, and mortality. As alternatives, Traditional Chinese medicinal herbs have demonstrated concrete effects in mitigating hyperuricemia in different experiments. Researchers have made efforts to investigate the role of herbal medicine in attenuating hyperuricemia. This review focuses on traditional Chinese herbal medicines that have been reported to ameliorate hyperuricemia in experimental studies.",Xu Li; Lu Li Li; Gao Jian Dong,Evid Based Complement Alternat Med,2021,en,hypertension_tcm.csv
PMID34229020,34229020,Anti-hypertensive and cardioprotective activities of traditional Chinese medicine-derived polysaccharides: A review.,"Cardiovascular diseases (CVDs), a leading cause of death in modern society, have become a major public health issue globally. Although numerous approaches have been proposed to reduce morbidity and mortality, the pursuit of pharmaceuticals with more preventive and/or therapeutic value remains a focus of attention. Being a vast treasure trove of natural drug molecules, Traditional Chinese Medicine (TCM) has a long history of clinical use in the prophylaxis and remedy of CVDs. Increasing lines of preclinical evidence have demonstrated the effectiveness of TCM-derived polysaccharides on hindering the progression of CVDs, e.g. hypertension, myocardial infarction. However, to the best of our knowledge, there are few reviews on the application of TCM-derived polysaccharides in combating CVDs. Hence, we provide an overview of primary literature on the anti-hypertensive and cardioprotective activities of herbal polysaccharides. Additionally, we also discuss the current limitations and propose a new hypothesis about how polysaccharides exert cardiovascular effects based on the metabolism of polysaccharides.",Xie Miaotian; Tao Weili; Wu Fengjia; Wu Kunlin; Huang Xiujie; Ling Gensong; Zhao Chuanyi; Lv Qian; Wang Qiongjin; Zhou Xianhuan; Chen Ying; Yuan Qin; Chen Yicun,Int J Biol Macromol,2021,en,hypertension_tcm.csv
PMID37125587,37125587,"Correlation analysis of hypertension, traditional Chinese medicine constitution, and LPL gene polymorphism in the elderly in communities in Shanghai.","[BACKGROUND] Research on the genetic mechanisms of hypertension has been a hot topic in the cardiovascular field. [OBJECTIVE] To study the correlation between senile hypertension and traditional Chinese medicine (TCM) constitution and lipoprotein lipase (LPL) gene polymorphism and to provide the theoretical basis for TCM prevention and treatment of hypertension. [METHODS] The elderly population in communities in Shanghai (hypertensive: 264 cases; non-hypertensive: 159 cases) was taken as the research object. Essential data and information on TCM constitution were collected. The LPL gene mutation was detected using the second-generation sequencing method. Statistical analysis was performed to clarify the relationship between hypertension and senile hypertension. The correlation of TCM constitution with risk factors and LPL gene polymorphisms was studied. [RESULTS] The primary TCM constitutions in the hypertension group were phlegm-dampness constitution (51.52%), yin-deficiency constitution (17.42%), balanced constitution (15.53%), and yin-deficiency (9.43%). Logistic regression analysis showed that the phlegm-dampness constitution (P< 0.05, OR = 2.587) and yin-deficiency constitution (P< 0.01, OR = 2.693) were the risk constitutions of hypertension in the elderly. A total of 37 LPL gene mutation loci (SNP: 22; new discovery: 15) were detected in the LPL gene, and the mutation rates of rs254, rs255, rs3208305, rs316, rs11570891, rs328, rs11570893, and rs13702 were relatively high, which were 26.24%, 26.24%, 16.08%, 14.66%, 13.24%, 12.06%, and 10.64%. In the phlegm-dampness group, the proportion of rs254 CC type, rs255 TT type, and rs13702 TT type in the hypertensive group (77.21%, 77.21%, and 93.38%) was higher than that in the non-hypertensive group (56.41%, 56.41%, and 82.05%), The difference was statistically significant (P< 0.05). [CONCLUSION] The phlegm-dampness constitution and yin-deficiency constitution are the risk factors of hypertension in the elderly; in the phlegm-dampness population, rs254 CC type, rs255 TT type, and rs13702 TT type are the risk factors for elderly hypertension.",Tao Ying; Jiang Li-Ming; Zhou Chang; Lin Yun-Xiao; Yang Yan-Qing; Wang You-Hua,Technol Health Care,2024,en,hypertension_tcm.csv
PMID32612527,32612527,The Effect of Chinese Herbal Medicine Combined With Western Medicine on Vascular Endothelial Function in Patients With Hypertension: A Systematic Review and Meta-Analysis of Randomized Controlled Trials.,"[OBJECTIVE] Vascular endothelium plays a fundamental role in regulating endothelial dysfunction, resulting in structural changes that may lead to adverse outcomes of hypertension. The aim of this study was to systematically evaluate the effect of a combination of Chinese herbal medicine (CHM) and Western medicine on vascular endothelial function in patients with hypertension. [METHODS] We systematically searched the literature for studies published in Chinese and English in PubMed, Embase, Cochrane Central Register of Controlled Trials, Chinese Biomedical Literature Database, China Knowledge Resource Integrated Database, Wanfang Data, and China Science and Technology Journal Database. Databases were searched using terms concerning or describing CHM, hypertension, vascular endothelium, and randomized controlled trials. RevMan 5.3.0 was used for data analysis. If the included studies were sufficiently homogeneous, quantitative synthesis was performed; if studies with different sample sizes and blind methods were used, subgroup analyses were performed. GRADEpro was selected to grade the current evidence to reduce bias in our findings. [RESULTS] In this review, 30 studies with 3,235 patients were enrolled. A relatively high selection and a performance bias were noted by risk of bias assessments. Meta-analysis showed that the combination of CHM and conventional Western medicine was more efficient than conventional Western medicine alone in lowering blood pressure (risk ratio, 1.21; 95% CI, 1.16 to 1.26) and increasing nitric oxide (95% CI, 1.24 to 2.08;0.00001), endothelin-1 (95% CI, -1.71 to -1.14;0.00001), and flow-mediated dilation (95% CI, 0.98 to 1.31;0.00001). No significant difference was observed between the combination of CHM and conventional Western medicine and conventional Western medicine alone for major cardiovascular and cerebrovascular events. CHM qualified for the treatment of hypertension. The GRADEpro presented with low quality of evidence for the available data. [CONCLUSION] CHM combined with conventional Western medicine may be effective in lowering blood pressure and improving vascular endothelial function in patients with hypertension. To further confirm this, more well-designed studies with large sample sizes, strict randomization, and clear descriptions about detection and reporting processes are warranted.",Ren Weiquan; Wang Miyuan; Liao Jiangquan; Li Lingling; Yang Deshuang; Yao Ruiqi; Huang Li,Front Pharmacol,2020,en,hypertension_tcm.csv
PMID34120132,34120132,The Association Between Traditional Chinese Medicine Body Constitution Deviation and Essential Hypertension: A Case-Control Study.,"[BACKGROUND] The prevention and treatment of hypertension is valued globally. The World Health Organization advocates combining traditional medicines in the prevention and treatment of diseases. Traditional Chinese medicine (TCM) assumes that diseases originate from the attenuation of one's body constitution. A few studies have found that hypertension is correlated with TCM body constitution. However, body constitution is also affected by living environment. Therefore, investigating the correlation between deviations in body constitution and essential hypertension in different living environments is necessary to provide the basis for using TCM in combination with conventional Western medicine to prevent and treat hypertension. [PURPOSE] The aim of this study was to explore the association between TCM body constitution deviation and essential hypertension. [METHODS] A case-control study was designed. Participants were selected from the outpatient clinics and neighboring communities of a regional teaching hospital in southern Taiwan. The study included 210 hypertension and 210 nonhypertension cases. Blood pressures were measured using an electronic sphygmomanometer to confirm the presence or absence of hypertension. The TCM Body Constitution Questionnaire, demographic datasheet, and hypertension-related factors questionnaire were used to collect data. [RESULTS] A higher proportion of patients with body constitution deviation were found in the hypertension group than the nonhypertension group. The proportions of patients with Yin-Xu, Yang-Xu, and stasis constitution were 44.8%, 32.4%, and 30.6%, respectively, in the hypertension group and 28.6%, 25.2%, and 19.6%, respectively, in the nonhypertension group. After performing univariate analysis, the results showed significant differences between the two groups in terms of average body mass index; emotional traits of anger, worry, and fear; hyperlipidemia; hyperuricemia; Yin-Xu constitution; and stasis constitution. However, the multivariate analysis revealed having a Yin-Xu constitution to be a risk factor of essential hypertension after adjusting for age, gender, body mass index, emotional traits, drinking habit, hyperlipidemia, and hyperuricemia. [CONCLUSIONS/IMPLICATIONS FOR PRACTICE] The results suggest that Yin-Xu and stasis constitutions are respectively associated with essential hypertension. The findings offer a valuable reference to governments and healthcare professionals to prevent the risk of essential hypertension. Screening and healthcare measures for TCM Yin-Xu or stasis constitution may be included in related prevention plans to minimize public exposure to the risk factors of essential hypertension.",Liao Yung-Cheng; Chen Li-Li; Wang Hsiao-Chiao; Lin Jui-Shan; Lin Tin-Kwang; Lin Shu-Chuan Amy,J Nurs Res,2021,en,hypertension_tcm.csv
PMID37268944,37268944,HMGB1-induced activation of ER stress contributes to pulmonary artery hypertension in vitro and in vivo.,"[BACKGROUND] HMGB1 and ER stress have been considered to participate in the progression of pulmonary artery hypertension (PAH). However, the molecular mechanism underlying HMGB1 and ER stress in PAH remains unclear. This study aims to explore whether HMGB1 induces pulmonary artery smooth muscle cells (PASMCs) functions and pulmonary artery remodeling through ER stress activation. [METHODS] Primary cultured PASMCs and monocrotaline (MCT)-induced PAH rats were applied in this study. Cell proliferation and migration were determined by CCK-8, EdU and transwell assay. Western blotting was conducted to detect the protein levels of protein kinase RNA-like endoplasmic reticulum kinase (PERK), activating transcription factor-4 (ATF4), seven in absentia homolog 2 (SIAH2) and homeodomain interacting protein kinase 2 (HIPK2). Hemodynamic measurements, immunohistochemistry staining, hematoxylin and eosin staining were used to evaluate the development of PAH. The ultrastructure of ER was observed by transmission electron microscopy. [RESULTS] In primary cultured PASMCs, HMGB1 reduced HIPK2 expression through upregulation of ER stress-related proteins (PERK and ATF4) and subsequently increased SIAH2 expression, which ultimately led to PASMC proliferation and migration. In MCT-induced PAH rats, interfering with HMGB1 by glycyrrhizin, suppression of ER stress by 4-phenylbutyric acid or targeting SIAH2 by vitamin K3 attenuated the development of PAH. Additionally, tetramethylpyrazine (TMP), as a component of traditional Chinese herbal medicine, reversed hemodynamic deterioration and vascular remodeling by targeting PERK/ATF4/SIAH2/HIPK2 axis. [CONCLUSIONS] The present study provides a novel insight to understand the pathogenesis of PAH and suggests that targeting HMGB1/PERK/ATF4/SIAH2/HIPK2 cascade might have potential therapeutic value for the prevention and treatment of PAH.",Zhang Qianqian; Chen Yuqian; Wang Qingting; Wang Yan; Feng Wei; Chai Limin; Liu Jin; Li Danyang; Chen Huan; Qiu Yuanjie; Shen Nirui; Shi Xiangyu; Xie Xinming; Li Manxiang,Respir Res,2023,en,hypertension_tcm.csv
PMID27760557,27760557,Chinese herbal medicine for the treatment of primary hypertension: a methodology overview of systematic reviews.,"[BACKGROUND] Chinese herbal medicine has been used to treat hypertension in China and East Asia since centuries. In this study, we conduct an overview of systematic reviews of Chinese herbal medicine in the treatment of primary hypertension to 1) summarize the conclusions of these reviews, 2) evaluate the methodological quality of these reviews, and 3) rate the confidence in the effect on each outcome. [METHODS] We comprehensively searched six databases to retrieve systematic reviews of Chinese herbal medicine for primary hypertension from inception to December 31, 2015. We used AMSTAR to evaluate the methodological quality of included reviews, and we classified the quality of evidence for each outcome in included reviews using the GRADE approach. [RESULTS] A total of 12 systematic reviews with 31 outcomes were included, among which 11 systematic reviews focus on the therapeutic effect of Chinese herbal medicine combined with conventional medicine or simple Chinese herbal medicine versus simple conventional medicine. Among the 11 items of AMSTAR, the lowest quality was ""providing a priori design"" item, none review conformed to this item, the next was ""stating the conflict of interest"" item, only three reviews conformed to this item. Five reviews scored less than seven in AMSTAR, which means that the overall methodological quality was fairly poor. For GRADE, of the 31 outcomes, the quality of evidence was high in none (0 %), moderate in three (10 %), low in 19 (61 %), and very low in nine (29 %). Of the five downgrading factors, risk of bias (100 %) was the most common downgrading factor in the included reviews, followed by imprecision (42 %), inconsistency (39 %), publication bias (39 %), and indirectness (0 %). [CONCLUSIONS] The methodological quality of systematic reviews about Chinese herbal medicine for primary hypertension is fairly poor, and the quality of evidence level is low. Physicians should be cautious when applying the interventions in these reviews for primary hypertension patients in clinical practice.",Xinke Zhao; Yingdong Li; Mingxia Feng; Kai Liu; Kaibing Chen; Yuqing Lu; Shaobo Sun; Peng Song; Bin Liu,Syst Rev,2016,en,hypertension_tcm.csv
PMID38515855,38515855,Hyperuricemia research progress in model construction and traditional Chinese medicine interventions.,"Hyperuricemia (HUA), a severe metabolic disease derived from purine metabolism disorder, will lead to abnormally increased serum uric acid (SUA) levels in the body. Studies have shown that HUA is highly related to gout, hypertension, diabetes, coronary heart disease, chronic kidney diseases, and so on. Traditional Chinese medicine (TCM) shows excellent results in treating HUA because of its unique advantages of multi-metabolites and multi-targets. This article reports on the use of TCM components for uric acid (UA)-lowering activity with excellent efficacy and low side effects based on established HUA models. This work summarizes the advantages and limitations of various HUA disease models for efficacy evaluation. Applications of TCM in HUA treatment have also been discussed in detail. This paper reveals recent research progress on HUA in constructing evaluation models and systematic TCM interventions. It will provide a scientific reference for establishing the HUA model and suggest future TCM-related HUA studies.",Zhou Hongyan; Yang Jingyi; Yuan Xiaoqing; Song Xinyu; Zhang Xingcai; Cao Ting; Zhang Jiayu,Front Pharmacol,2024,en,hypertension_tcm.csv
PMID38401689,38401689,Efficacy and safety of chinese herbal foot bath for hypertension: A systematic review and meta-analysis.,"[BACKGROUND] Hypertension is a prevalent condition with significant impacts on human health. Chinese herbal foot bath, a traditional Chinese medicine treatment, is believed to help manage hypertension. [OBJECTIVE] This systematic review aims to assess the efficacy of combining Chinese herbal foot bath with conventional treatment for hypertension. [METHODS] A thorough search across eight databases was conducted to identify relevant studies on Chinese herbal foot bath for hypertension. Randomized controlled trials examining the benefits and risks of using Chinese herbal foot bath combined with conventional treatment for hypertension were included. Blood pressure changes before and after the Chinese herbal foot bath were assessed, and outcomes were analyzed using Review Manager 5.3 software. The certainty of evidence was evaluated using the GRADE tool. [RESULTS] Compared to conventional treatment, Chinese herbal foot bath combined with conventional treatment demonstrated greater effectiveness in reducing systolic blood pressure (MD 6.69, 95% CI: 5.86 to 7.53, p < 0.00001) and diastolic blood pressure (MD 5.83, 95% CI: 5.23 to 6.43, p < 0.00001), which reported fewer adverse effects.These studies commonly present issues such as inadequate randomization, lack of blinding, and absence of independent testing for the purity or potency of herbs. [CONCLUSION] The meta-analysis suggests that Chinese herbal foot bath combined with conventional treatment may effectively manage hypertension, with few adverse effects. However, high-quality clinical trials are still needed to confirm these findings due to methodological weaknesses in randomization, blinding, long-term follow-up, and independent testing for the purity and potency of herbs.",Wu Tong; Zhou Luolin; Liao Xinru; He Yuewen; Xu Ronglin; Luo Daihong,Complement Ther Med,2024,en,hypertension_tcm.csv
