article_id,pmid,title,abstract,authors,journal,pub_year,language,source_file
PMID28434477,28434477,Niuhuang Jiangya Preparation (a traditional Chinese patent medicine) for essential hypertension: A systematic review.,"[OBJECTIVES] Niuhuang Jiangya Preparation (NHJYP) is one of the most commonly used traditional Chinese patent medicines for essential hypertension (EH) in China. Our meta-analysis performed a systematic evaluation on the therapeutic efficacy and safety of NHJYP for EH. [DESIGN] Systematic review and meta-analysis. [METHODS] PubMed, Embase, the Cochrane library, CNKI,VIP, Sinomed, and Wanfang Database were searched up to June 2015. Randomized controlled trials (RCTs) comparing NHJYP or combined with western antihypertensive drugs (WAD) versus WAD were included. Quality of each trial was assessed according to the Cochrane Reviewers' Handbook 5. 1.0. Statistical software (RevMan 5.3) was used for data analysis. The primary outcome was categorical or continuous blood pressure, and the secondary outcome was Traditional Chinese Medicine (TCM) syndrome. [RESULTS] 12 RCTs including 1651 cases were identified. The methodological quality of trials was low. Meta-analysis showed that, firstly, NHJYP used alone compared with WAD had no significant effect on BP reduction; however, subgroup analysis was used based on whether apply TCM diagnostic criteria in recruitment. It was suggested that, for population that applied TCM diagnostic criteria, RR=1.35,95% CI:1.17-1.56，P<0.0001; for population that didn't apply TCM diagnostic criteria, RR=0.96,95% CI：0.70-1.33，P=0.81.Reduction in systolic blood pressure (SBP) levels showed similar results. But there was no significant difference in improving diastolic blood pressure (DBP). Secondly, we found that NHJYP plus WAD probably lower BP (RR=1.13，95% CI:1.03-1.24,P=0.01)and improve TCM symptoms than WAD only. And subgroup analysis suggested significant BP reduction effect for population that applied TCM diagnostic. No serious adverse events were reported. [CONCLUSIONS] Our review indicated that NHJYP has some beneficial effects in EH patients with liver-yang hyperactivity and abundant phlegm-heat syndrome. However, the evidence is not reliable enough. To produce definite evidence, more rigorously designed trials are needed.",Wang Hui; Liu Chunxiang; Zhai Jingbo; Shang Hongcai,Complement Ther Med,2017,en,hypertension_tcm.csv
PMID36265555,36265555,Hypertensive heart disease and myocardial fibrosis: How traditional Chinese medicine can help addressing unmet therapeutical needs.,"Long-term elevated blood pressure will increase the cardiac load and lead to myocardial fibrosis (MF). A variety of pathological mechanisms and signal transduction pathways are involved in the process of hypertensive MF, which is of great significance for the occurrence and development of ventricular dilatation and heart failure. MF is the pathological basis of hypertensive heart disease (HHD), and blood pressure control is the key to delaying MF and reducing the occurrence of cardiovascular events. Although a large number of experimental results suggest that anti-MF drug therapy has made great progress, the conclusions of relevant clinical trials are still not optimistic, and it is urgent to find new effective anti-MF medicine. The clinical efficacy of traditional Chinese medicine (TCM) in the treatment of MF in HHD is obvious, and some achievements have been made in the mechanism research. Studies have confirmed that a variety of TCM compound prescription and natural compounds play different degrees of inhibitory effect on MF. In this study, we reviewed the pathogenesis of MF in HHD and the current drug treatment strategies, summarized the latest research progress of TCM in the treatment of MF in HHD, and demonstrated the mechanism of its cardiac protective effect. Finally, we pointed out the limitations of the current study and prospected the future research of TCM.",Liu Mengnan; Long Xingru; Xu Jie; Chen Mingtai; Yang Huayi; Guo Xin; Kang Junli; Ouyang Yue; Luo Gang; Yang Sijin; Zhou Hua,Pharmacol Res,2022,en,hypertension_tcm.csv
PMID30183389,30183389,Wet cupping for hypertension: a systematic review and meta-analysis.,"To assess the efficacy and safety of wet cupping in adults with hypertension, we conducted a systematic review and meta-analysis using 13 databases. Wet cupping alone or in combination with antihypertensive medication or acupuncture was used. Seven randomized trials were included, most not of high methodological quality. A few small studies suggested that wet cupping alone versus antihypertensive medication significantly reduced blood pressure and Traditional Chinese Medicine syndrome (hypertension-related symptoms). However based on current evidence, no firm conclusions can be drawn and no clinical recommendations made. Research projects included need validation. Studies indicate that wet cupping is a safe therapy.",Lu Shuting; Du Shizheng; Fish Anne; Tang Cong; Lou Qingqing; Zhang Xuefang,Clin Exp Hypertens,2019,en,hypertension_tcm.csv
PMID31100657,31100657,Therapeutic effect of angelica and its compound formulas for hypertension and the complications: Evidence mapping.,"[BACKGROUND] Hypertension is one of the common diseases, which brings heavy burden to human race. Currently, western medication is in absolutely dominant position in the treatment of hypertension, but it maintains for a short time and there are various side effects and drug tolerance. Therefore, Chinese medicine has attracted great attention in the treatment field of hypertension, and angelica is one of the most frequently used herbs. [OBJECTIVES] In order to give some inspiration to researches in these fields, this article presents the current research status of angelica and its compound formulas treating hypertension and its complications with evidence mapping. [METHODS] Main databases were systematically searched, and researches about angelica or its compound formulas containing angelica treating hypertension or its complications were included. EXCEL 2013 was used to integrate and process the data, and the result is showed intuitively with the bubble diagram. [RESULTS] 49 RCTs were included after screening. The articles recruited were published with a rising trend along with time. Of the 49 RCTs, there is the outcome measure of general the efficacy in the result part in 34 RCTs (69.4%), and all the clinical effective rate in the angelica intervention group is significantly higher than the control group. There is the outcome measure of reduction of MAP in the result part in 28 RCTs, and 27 RCTs (96.4%) showed that the angelica intervention group is significantly improved than the control group while 1 (3.6%) showed no significant differences. There is the outcome measure of efficacy of target organ protection in the result part in 26 RCTs, and 25 RCTs (96.2%) showed that there is significant difference between the angelica intervention group and the control group. Of the 49 RCTs, there is the outcome measure of adverse effects in the result part in 17 RCTs. 14 RCTs (82.4%) reported no adverse effects, 2 RCTs (11.8%) reported adverse effects rate as lower than 10%, and 1 RCT (7.1%) reported adverse effects rate as higher than 40%. [CONCLUSION] Current research with low quality has revealed that angelica is effective in reduction of MAP and target organ protection and the adverse effects rate is low, and the effectiveness and safety of angelica needs to be proved by further researches with high quality. Researches of high quality are needed to provide scientific evidence for angelica in treating hypertension and its complications.",Wei Huiping; Xiao Yujie; Tong Yajing; Chen Yaolong; Luo Xufei; Wang Yu; Jin Pei; Ma Chengxu; Fu Zhaoyuan; Guo Huan; Zhao Xinke; Li Yingdong,Phytomedicine,2019,en,hypertension_tcm.csv
PMID38701237,38701237,Intervention of hypertension by acupuncture-related therapies: A network meta-analysis.,"[BACKGROUND] The prevalence of essential hypertension contributed significantly to morbidity and mortality rates. Acupuncture-related therapies were commonly employed in hypertension treatment. Nevertheless, a lack of conclusive evidence left uncertainties regarding the optimal strategies for managing hypertensive populations. [OBJECTIVES] Conduct a comprehensive systematic review to evaluate the existing clinical evidence about the effectiveness of acupuncture and moxibustion-related therapies in managing hypertension, by employing network meta-analysis techniques. [METHODS] A comprehensive electronic search was conducted across n of databases. This search covered studies available up to October 2022. Randomized controlled trials assessing acupuncture and moxibustion-related therapies in managing hypertension based on traditional Chinese medicine were screened. Primary outcome measures included the antihypertensive effectiveness rate, variations in blood pressure and the incorporation of Traditional Chinese Medicine (TCM) syndrome manifestations. The review follows the guidelines outlined in the PRISMA statement. [RESULTS] We identified a total of 24 trials with 1867 patients, which evaluated the efficacy of various acupuncture-related therapies for hypertension management. Network meta-analysis showed that moxibustion and auricular point sticking combined with medication therapy had the best effect in terms of antihypertensive effective rate (medication + moxibustion + auricular pressure vs. medication = 1.29 [1.09, 1.54]; sucra = 85.9, p < .05) and hypertension symptom improvement (medication + moxibustion + auricular pressure vs. medication = -1.55 [-2.98, -0.13]; sucra = 96.1, p < .05). Acupuncture combined with moxibustion combined with medication therapy had the best effect in reducing systolic pressure (medication + moxibustion + acupuncture vs. medication = -8.50 [-10.19, -6.80]; sucra = 100, p < .05) and diastolic blood pressure (medication + moxibustion + acupuncture versus medication = -4.72 [-6.71, -2.72]; sucra = 99.71, p < 0.05). [CONCLUSIONS] Network meta-analysis suggested that the combined use of moxibustion and auricular point application in conjunction with drug therapy showed the highest likelihood of being the most effective treatment in terms of antihypertensive efficiency rates and improvement in hypertension symptoms. Furthermore, the combination of acupuncture and moxibustion alongside drug treatment emerged as the most promising approach for reducing systolic blood pressure and diastolic blood pressure. Limited by the methodological quality and quantity of the included studies, the results need to be interpreted with caution. It is necessary to conduct more high-quality randomized controlled trials of acupuncture-related therapies for the adjuvant treatment of hypertension in the future. [IMPLICATIONS FOR PRACTICE] Clinicians can use acupuncture-related therapies to inform their treatment decisions and potentially incorporate acupuncture-related therapies into their hypertension management protocols.",Zhang Huiling; Xia Zheyuan; Liu Yongjun; Yu Shuang; Shi Hui; Meng Yahui; Wu Xinyu,Int J Older People Nurs,2024,en,hypertension_tcm.csv
PMID30286626,30286626,Acupuncture Application in Chronic Kidney Disease and its Potential Mechanisms.,"Chronic kidney disease (CKD) is an increasing major public health problem worldwide. The number of CKD patients on hemodialysis is growing rapidly as well. Acupuncture technique is one of the traditional Chinese medicine methods and has been used in a variety of diseases. Nowadays, the clinical application of acupuncture technique for CKD patients has become the focus for its effectiveness and security. In this paper, we will review the therapeutic effects and mechanisms of different acupuncture techniques for CKD patients. In patients with CKD, acupuncture improves renal function, reduces proteinuria, controls hypertension, corrects anemia, relieves pain, and controls many hemodialysis-related complications such as uremic pruritus, insomnia and fatigue. The mechanisms are related to the regulation of sympathetic nerve and the activation of bioactive chemicals. In conclusion, acupuncture is proved to be beneficial for CKD patients. More research, however, is needed to verify the potential mechanisms.",Xiong Wei; He Fang-Fang; You Ren-Yu; Xiong Jing; Wang Yu-Mei; Zhang Chun; Meng Xian-Fang; Su Hua,Am J Chin Med,2018,en,hypertension_tcm.csv
PMID35643068,35643068,Mechanistic and therapeutic perspectives of baicalin and baicalein on pulmonary hypertension: A comprehensive review.,"Pulmonary hypertension (PH) is a chronic and fatal disease, for which new therapeutic drugs and approaches are needed urgently. Baicalein and baicalin, the active compounds of the traditional Chinese medicine, Scutellaria baicalensis Georgi, exhibit a wide range of pharmacological activities. Numerous studies involving in vitro and in vivo models of PH have revealed that the treatment with baicalin and baicalein may be effective. This review summarizes the potential mechanisms driving the beneficial effects of baicalin and baicalein treatment on PH, including anti-inflammatory response, inhibition of pulmonary smooth muscle cell proliferation and endothelial-to-mesenchymal transformation, stabilization of the extracellular matrix, and mitigation of oxidative stress. The pharmacokinetics of these compounds have also been reviewed. The therapeutic potential of baicalin and baicalein warrants their continued study as natural treatments for PH.",Cui Lidan; Yuan Tianyi; Zeng Zuomei; Liu Dianlong; Liu Chenxiao; Guo Jian; Chen Yucai,Biomed Pharmacother,2022,en,hypertension_tcm.csv
PMID30712726,30712726,Efficacy and safety of acupuncture for hypertension: An overview of systematic reviews.,"[BACKGROUND AND PURPOSE] Acupuncture is widely used in the treatment of hypertension, yet its efficacy and safety for hypertension remain controversial. This overview aimed to summarize the evidence on acupuncture for hypertension. [METHODS] Eight databases were searched. The Assessment of Multiple Systematic Reviews (AMSTAR) tool and the Grading of Recommendations Assessment, Development and Evaluation (GRADE) approach were performed. [RESULTS] Fifteen systematic reviews (SRs) were identified. Methodological quality and quality of evidence were unsatisfactory. Acupuncture combined with Western medicine (WM) was superior to WM in systolic blood pressure (SBP) and diastolic blood pressure (DBP), efficacy rate, and traditional Chinese medicine (TCM) syndrome. Acupuncture was more effective in treating SBP and DBP than sham acupuncture plus WM. Evidence regarding the benefit of acupuncture alone for SBP and DBP, efficacy rate and TCM syndrome was inconsistent. No serious adverse effects were identified. [CONCLUSION] High-quality SRs and randomized controlled trials (RCTs) are required.",Zhao Huimin; Li Dan; Li Yuling; Yang Ying; Liu Yueting; Li Jie; Mao Jing,Complement Ther Clin Pract,2019,en,hypertension_tcm.csv
PMID33381202,33381202,Traditional Chinese Medicine for Essential Hypertension: A Clinical Evidence Map.,"We systematically retrieved and summarised clinical studies on traditional Chinese medicine (TCM) for the prevention and treatment of essential hypertension (EH) using the evidence map. We aimed to explore the evidence distribution, identify gaps in evidence, and inform on future research priorities. Clinical studies, systematic reviews, guidelines, and pathway studies related to TCM for the prevention and treatment of EH, published between January 2000 and December 2019, were included from databases CNKI, WanFang Data, VIP, PubMed, Embase, and Web of Science. The distribution of evidence was analysed using text descriptions, tables, and graphs. A total of 9,403 articles were included, including 5,920 randomised controlled studies (RCTs), 16 guidelines, expert consensus and path studies, and 139 systematic reviews (SRs). The articles publishing trend increased over time. This study showed that the intervention time of TCM was concentrated at 4-8 weeks, mainly through Chinese herbal medicine (CHM) for the prevention and treatment of elderly hypertension and the complications. A Measurement Tool to Assess Systematic Reviews (AMSTAR) scores of the included reviews ranged from 2 to 10. Most of the SRs had a potentially positive effect (= 120), mainly in 5-8 score. Primary studies and SRs show potential benefits of TCM in lowering blood pressure, lowering the TCM syndrome and symptom differentiation scores (TCM-SSD scores), improving the total effective rate, and reducing the adverse events. The adjunctive effect of TCM on improving the total effective rate, lowering the blood pressure, lowering the TCM-SSD scores, and lowering the adverse effects was only supported by low-quality evidence in this research. The evidence map was used to show the overall research on TCM for the treatment of EH; however, due to the existing problems of the primary studies, the current research conclusion needs further research with higher quality and standardisation.",Zhang Yan; Wang Biqing; Ju Chunxiao; Liu Lu; Zhu Ying; Mei Jun; Liu Yue; Xu Fengqin,Evid Based Complement Alternat Med,2020,en,hypertension_tcm.csv
PMID24761624,24761624,[Overview and prospect of syndrome differentiation of hypertension in traditional Chinese medicine].,"This article is to overview the literature of syndrome differentiation of traditional Chinese medicine on hypertension. According to the theory of disease in combination with syndrome, we concluded syndrome types of hypertension in four aspects, including national standards, industry standards, teaching standards and personal experience. Meanwhile, in order to provide new methods and approaches for normalized research, we integrated modern testing methods and statistical methods to analyze syndrome differentiation for the treatment of hypertension.",Yang Xiao-Chen; Xiong Xing-Jiang; Wang Jie,Zhongguo Zhong Yao Za Zhi,2014,zh,hypertension_tcm.csv
PMID21144453,21144453,[Relationships between insulin resistant and hypertension and traditional Chinese medicine intervention].,"Recently many researches have demonstrated that insulin resistant (IR), as an important pathologic process, is increasingly involved with a series of diseases such as central obesity and diabetes. Hypertension is highly associated with IR. The relationships between IR and glucose or lipid metabolism disorders are well established. However, association of IR with hypertension is less covered. Current researches on insulin resistance and pathogenesis of hypertension are reviewed in this paper, which holds that traditional Chinese medicine treatment on IR in patients with hypertension has a good prospect.",Chen Yi; Wang Wen-jian,Zhong Xi Yi Jie He Xue Bao,2010,zh,hypertension_tcm.csv
PMID40350827,40350827,[Traditional Chinese medicine understanding and treatment strategies for hypertension com plicated by chronic low back pain from perspective of kidney deficiency syndrome].,"In China, the number of chronic pain patients has exceeded 300 million, making chronic pain the third major health problem after tumors and cardiovascular diseases. Particularly concerning is the gradual emergence of hypertension and chronic low back pain as public health problems that threaten public health and increase the global economic burden. Modern research shows that the incidence of coexisting hypertension is higher among patients with chronic low back pain. Additionally, evidence indicates that the use of NSAIDs for pain relief can have adverse effects on blood pressure, and some antihypertensive medications may trigger symptoms of low back pain. Thus, addressing chronic pain in hypertensive patients while stabilizing blood pressure is one of the important research questions in the modern treatment of hypertension among middle-aged and elderly individuals. From ancient to modern traditional Chinese medicine(TCM) theory, kidney deficiency has been regarded as the core pathogenesis of low back pain. Recent clinical practices and literature indicate that kidney deficiency plays a crucial role in the modern pathogenesis of hypertension. Both hypertension and chronic low back pain are closely associated with kidney deficiency in TCM theory, revealing a potential mechanism linking the two conditions. Combining the theories of &quot; kidney-essence-marrow&quot; and &quot; nourishing water to moisten wood&quot;, a therapeutic strategy centered on tobifying kidney was proposed, including selecting single drugs with kidney-tonifying effects as well as compound formulations and elaborating modern research evidence. The aim is to achieve stable blood pressure control in hypertension patients with chronic low back pain while providing a new treatment perspective for chronic low back pain. This article systematically elaborates on the understanding of hypertension combined with chronic low back pain from both TCM and modern medicine, as well as the therapeutic strategy involving kidney-tonifying drugs, to offer useful references for clinical practice.",Luo Zheng-Rong; Gao Yin-Qiu; Xiong Xing-Jiang; Lyu Pin; Yang Xiao-Chen,Zhongguo Zhong Yao Za Zhi,2025,zh,hypertension_tcm.csv
PMID33645036,33645036,[Meta-analysis for clinical efficacy of traditional Chinese medicine in treating resistant hypertension].,"To systematically evaluate the efficacy and safety of traditional Chinese medicine in treating patients with resistant hypertension. CNKI, Wanfang, VIP, CBM, PubMed, Web of Science, Cochrane Library, EMbase and other databases were retrieved by computers to screen out the randomized controlled trial of traditional Chinese medicine in treating resistant hypertension. Cochrane Handbook was used to evaluate the quality of the included literature, RevMan 5.3 and Stata 12.0 was used for Meta-analysis. Finally, 11 literatures meeting the criteria were included, involving 1 023 patients. The results of Meta-analysis showed that the combined therapy of standard triple antihypertensive regimen with traditional Chinese medicine could further reduce systolic blood pressure of patients with resistant hypertension(MD=-16.69, 95%CI[-22.21,-11.16], P&lt;0.000 01), reduce diastolic blood pressure(MD=-7.51, 95%CI[-8.26,-6.76], P&lt;0.000 01), improve the effective rate of anti-hypertension(OR=5.16, 95%CI[3.01, 8.84], P&lt;0.000 01), improve the up-to-standard rate of blood pressure(OR=3.01, 95%CI[1.49, 6.09], P=0.002), and improve the effectiveness of clinical symptoms(OR=4.48, 95%CI[2.31, 8.68], P&lt;0.000 01), with no significant effect on creatinine level(MD=-2.51, 95%CI[-6.91, 1.89], P=0.26). The results of this study indicated that the combined therapy of standard triple antihypertensive regimen with traditional Chinese medicine could further improve the clinical efficacy in patients with resistant hypertension with a good safety, but more high-quality clinical studies are still needed to verify this conclusion.",Wang Meng-Xi; Wu Chen-Jie; Cao Pei-Hua; Chen Xiao-Hu,Zhongguo Zhong Yao Za Zhi,2021,zh,hypertension_tcm.csv
PMID38958884,38958884,Advance on Chinese Medicine for Hypertensive Renal Damage: Focus on the Complex Molecular Mechanisms.,"Hypertensive renal damage (HRD) is a major cause of end-stage renal disease. Among the causes of end-stage renal disease, HRD accounts for nearly 34% of the total number of cases. Antihypertensive treatment is primarily drug-based, but therapeutic efficacy is less effective and can have serious side effects. Chinese medicine (CM) has significant advantages in the treatment of HRD. CM is rich in various active ingredients and has the property of targeting multiple targets and channels. Therefore, the regulatory network of CM on disease is complex. A large number of CM have been employed to treat HRD, either as single applications or as part of compound formulations. The key possible mechanisms of CM for HRD include regulation of the renin-angiotensin-aldosterone system, antioxidation, anti-inflammation, rescue of endothelial function, regulation of vasoactive substance secretion and obesity-related factors, etc. This review summarized and discussed the recent advance in the basic research mechanisms of CM interventions for HRD and pointed out the challenges and future prospects.",Lu Yan; Xie Xue-Na; Xin Qi-Qi; Yuan Rong; Miao Yu; Cong Wei-Hong; Chen Ke-Ji,Chin J Integr Med,2024,en,hypertension_tcm.csv
PMID31008483,31008483,[Molecular mechanism of vascular remodeling in hypertension and Chinese medicine intervention].,"Vascular remodeling is a significant pathological characteristic of hypertension, which is regulated by complex regulatory networks. The vascular remodeling may be adaptive initially, however it becomes maladaptive and decompensation eventually and further compromises target organ function, leading to hypertensive cardiovascular complications. This review focuses on the role and mechanisms of vascular remodeling in the pathogenesis and progression of hypertension and its complications. Moreover, the strategies of syndrome differentiation of traditional Chinese medicine application provide clinical and theoretical evidences for hypertensive vascular remodeling therapy. A better understanding of underlying signaling pathways, therapeutic targets in vascular remodeling, as well as screening of active ingredients from traditional Chinese medicine may be able to provide some effective approaches for vascular protection in hypertensive diseases.",Zhang Chan-Juan; Shi Ya-Ning; Liao Duan-Fang; DU Ke; Qin Li,Sheng Li Xue Bao,2019,zh,hypertension_tcm.csv
